Category,Question ID,Question,Source,Answers
Treatment - Disinfectant Injections,103,is it true that i can get rid of covid by drinking cleaners,Author Generated,"a no. always follow the instructions on household cleaners. disinfectant sprays or wipes are intended for use on hard, non porous surfaces. disinfectant sprays or wipes are not intended for use on humans or animals. do not use disinfectant sprays or wipes on your skin because they may cause skin and eye irritation. do not inject, inhale, or ingest disinfectant sprays or household cleaners; doing so is dangerous and may cause serious harm or death. if ingested, call poison control or a medical professional immediately. , no. those products work on surfaces but can be dangerous to your body. , thats a bad idea, said dr. colleen kraft, an infectious diseases professor at emory university school of medicine. it could definitely kill you."
Treatment - Disinfectant Injections,103,can disinfectant sprays cure me if i have covid,Author Generated,"a no. always follow the instructions on household cleaners. disinfectant sprays or wipes are intended for use on hard, non porous surfaces. disinfectant sprays or wipes are not intended for use on humans or animals. do not use disinfectant sprays or wipes on your skin because they may cause skin and eye irritation. do not inject, inhale, or ingest disinfectant sprays or household cleaners; doing so is dangerous and may cause serious harm or death. if ingested, call poison control or a medical professional immediately. , no. those products work on surfaces but can be dangerous to your body. , thats a bad idea, said dr. colleen kraft, an infectious diseases professor at emory university school of medicine. it could definitely kill you."
Prevention - Household Preparation,186,what steps can my family take to reduce our risk of getting covid,Center for Disease Control,"practice everyday preventive actions to help reduce your risk of getting sick and remind everyone in your home to do the same., create a household plan of action to help protect your health and the health of those you care about in the event of an outbreak of covid in your community ."
Prevention - Household Preparation,186,how can my family and i prepare for covid,Center for Disease Control,"practice everyday preventive actions to help reduce your risk of getting sick and remind everyone in your home to do the same., create a household plan of action to help protect your health and the health of those you care about in the event of an outbreak of covid in your community ."
Prevention - Household Preparation,186,what are some tips to help prepare in the event that covid becomes a pandemic,Quora,"practice everyday preventive actions to help reduce your risk of getting sick and remind everyone in your home to do the same., create a household plan of action to help protect your health and the health of those you care about in the event of an outbreak of covid in your community ."
Prevention - Household Preparation,186,what can i do to prepare my family for a covid outbreak,Author Generated,"practice everyday preventive actions to help reduce your risk of getting sick and remind everyone in your home to do the same., create a household plan of action to help protect your health and the health of those you care about in the event of an outbreak of covid in your community ."
Prevention - Household Preparation,186,how should people in the same house get ready for covid,Author Generated,"practice everyday preventive actions to help reduce your risk of getting sick and remind everyone in your home to do the same., create a household plan of action to help protect your health and the health of those you care about in the event of an outbreak of covid in your community ."
Prevention - Household Preparation,186,is there anything i can do to help my family prepare for covid,Author Generated,"practice everyday preventive actions to help reduce your risk of getting sick and remind everyone in your home to do the same., create a household plan of action to help protect your health and the health of those you care about in the event of an outbreak of covid in your community ."
Prevention - Household Preparation,186,how can families get ready for lockdown,Author Generated,"practice everyday preventive actions to help reduce your risk of getting sick and remind everyone in your home to do the same., create a household plan of action to help protect your health and the health of those you care about in the event of an outbreak of covid in your community ."
Reporting - Time First Identified,310,when was covid first identified,GitHub.com/deepset-ai/COVID-QA,"19 dec, 2003, 4 weeks, 19 dec, s first identified in wuhan, china, wuhan city, china, wuhan, capital of hubei province, china"
Reporting - Time First Identified,310,when was sars cov first identified,GitHub.com/deepset-ai/COVID-QA,"19 dec, 2003, 4 weeks, 19 dec, s first identified in wuhan, china, wuhan city, china, wuhan, capital of hubei province, china"
Reporting - Time First Identified,310,how long did it take to identify the cause of covid,GitHub.com/deepset-ai/COVID-QA,"19 dec, 2003, 4 weeks, 19 dec, s first identified in wuhan, china, wuhan city, china, wuhan, capital of hubei province, china"
Reporting - Time First Identified,310,when was the novel covid first reported,GitHub.com/deepset-ai/COVID-QA,"19 dec, 2003, 4 weeks, 19 dec, s first identified in wuhan, china, wuhan city, china, wuhan, capital of hubei province, china"
Reporting - Time First Identified,310,where and when was covid first identified,GitHub.com/deepset-ai/COVID-QA,"19 dec, 2003, 4 weeks, 19 dec, s first identified in wuhan, china, wuhan city, china, wuhan, capital of hubei province, china"
Reporting - Time First Identified,310,when was the first case of covid identified,GitHub.com/deepset-ai/COVID-QA,"19 dec, 2003, 4 weeks, 19 dec, s first identified in wuhan, china, wuhan city, china, wuhan, capital of hubei province, china"
Reporting - Time First Identified,310,where was covid first identified,GitHub.com/deepset-ai/COVID-QA,"19 dec, 2003, 4 weeks, 19 dec, s first identified in wuhan, china, wuhan city, china, wuhan, capital of hubei province, china"
Comparison - SARS,348,how much similarity the covid genome sequence has with sars cov,GitHub.com/deepset-ai/COVID-QA,"80% identity with sars cov, there are no remarkable differences between the orfs and nsps"
Comparison - SARS,348,how are covid and sars cov similar,GitHub.com/deepset-ai/COVID-QA,"80% identity with sars cov, there are no remarkable differences between the orfs and nsps"
Comparison - SARS,348,which covid is sars,Bing Search,"80% identity with sars cov, there are no remarkable differences between the orfs and nsps"
Comparison - SARS,348,whats the difference between covid and sars cov 2,Quora,"80% identity with sars cov, there are no remarkable differences between the orfs and nsps"
Comparison - SARS,348,is sars and covid the same thing,Author Generated,"80% identity with sars cov, there are no remarkable differences between the orfs and nsps"
Comparison - SARS,348,what is the relation between sars cov and covid,Author Generated,"80% identity with sars cov, there are no remarkable differences between the orfs and nsps"
Comparison - SARS,348,are sars cov and covid related,Author Generated,"80% identity with sars cov, there are no remarkable differences between the orfs and nsps"
Transmission - Water,6,can covid live in water,Google Search,there is no evidence that covid can be spread to humans through the use of pools and hot tubs.
Transmission - Water,6,can covid spread through water,Author Generated,there is no evidence that covid can be spread to humans through the use of pools and hot tubs.
Transmission - Water,6,can the covid virus spread through drinking water,Quora,there is no evidence that covid can be spread to humans through the use of pools and hot tubs.
Transmission - Water,6,is it possible for water to transmit covid,Author Generated,there is no evidence that covid can be spread to humans through the use of pools and hot tubs.
Transmission - Water,6,could covid potentially be transmitted through water,Author Generated,there is no evidence that covid can be spread to humans through the use of pools and hot tubs.
Transmission - Water,6,can i get covid from water,Author Generated,there is no evidence that covid can be spread to humans through the use of pools and hot tubs.
Symptoms - Stroke,10,can covid cause a stroke,Google Search,"yes, some young adults have subered strokes after getting covid. "
Symptoms - Stroke,10,is it true young people with covid are also having blood clots and strokes,Cable News Network,"yes, some young adults have subered strokes after getting covid. "
Symptoms - Stroke,10,do covid patients get strokes,Author Generated,"yes, some young adults have subered strokes after getting covid. "
Symptoms - Stroke,10,if i have covid will i have a stroke,Author Generated,"yes, some young adults have subered strokes after getting covid. "
Symptoms - Stroke,10,is it possible to get a stroke from covid,Author Generated,"yes, some young adults have subered strokes after getting covid. "
Symptoms - Stroke,10,can you have a stroke because of covid,Author Generated,"yes, some young adults have subered strokes after getting covid. "
Transmission - Antibody Immunity,15,who covid immunity,Google Search,"not necessarily. antibodies are a bodys response to bacteria or viruses. but this novel covid is so new, its still not clear whether having antibodies to it means you have long term protection from getting reinfected. "
Transmission - Antibody Immunity,15,do covid antibodies confer immunity,Google Search,"not necessarily. antibodies are a bodys response to bacteria or viruses. but this novel covid is so new, its still not clear whether having antibodies to it means you have long term protection from getting reinfected. "
Transmission - Antibody Immunity,15,do covid antibodies mean immunity,Google Search,"not necessarily. antibodies are a bodys response to bacteria or viruses. but this novel covid is so new, its still not clear whether having antibodies to it means you have long term protection from getting reinfected. "
Transmission - Antibody Immunity,15,do covid antibodies provide immunity,Google Search,"not necessarily. antibodies are a bodys response to bacteria or viruses. but this novel covid is so new, its still not clear whether having antibodies to it means you have long term protection from getting reinfected. "
Transmission - Antibody Immunity,15,will an antibody test show whether im immune and can go back to work,Cable News Network,"not necessarily. antibodies are a bodys response to bacteria or viruses. but this novel covid is so new, its still not clear whether having antibodies to it means you have long term protection from getting reinfected. "
Transmission - Antibody Immunity,15,why cant they take antibodies from people who have recovered from covid to create a vaccine,Quora,"not necessarily. antibodies are a bodys response to bacteria or viruses. but this novel covid is so new, its still not clear whether having antibodies to it means you have long term protection from getting reinfected. "
Transmission - Airborne,27,is covid airborne,Yahoo Search,"studies to date suggest that the virus that causes covid is mainly transmitted through contact with respiratory droplets rather than through the air., covid cannot travel very far in the air, the world health organization says. , studies to date suggest that the virus that causes covid is mainly transmitted through contact with respiratory droplets rather than through the air."
Transmission - Airborne,27,who covid airborne,Google Search,"studies to date suggest that the virus that causes covid is mainly transmitted through contact with respiratory droplets rather than through the air., covid cannot travel very far in the air, the world health organization says. , studies to date suggest that the virus that causes covid is mainly transmitted through contact with respiratory droplets rather than through the air."
Transmission - Airborne,27,is covid in the air,Google Search,"studies to date suggest that the virus that causes covid is mainly transmitted through contact with respiratory droplets rather than through the air., covid cannot travel very far in the air, the world health organization says. , studies to date suggest that the virus that causes covid is mainly transmitted through contact with respiratory droplets rather than through the air."
Transmission - Airborne,27,can the virus that causes covid be transmitted through the air,Quora,"studies to date suggest that the virus that causes covid is mainly transmitted through contact with respiratory droplets rather than through the air., covid cannot travel very far in the air, the world health organization says. , studies to date suggest that the virus that causes covid is mainly transmitted through contact with respiratory droplets rather than through the air."
Transmission - Airborne,27,can covid travel by wind,Cable News Network,"studies to date suggest that the virus that causes covid is mainly transmitted through contact with respiratory droplets rather than through the air., covid cannot travel very far in the air, the world health organization says. , studies to date suggest that the virus that causes covid is mainly transmitted through contact with respiratory droplets rather than through the air."
Transmission - Airborne,27,is covid airborne or droplet,Yahoo Search,"studies to date suggest that the virus that causes covid is mainly transmitted through contact with respiratory droplets rather than through the air., covid cannot travel very far in the air, the world health organization says. , studies to date suggest that the virus that causes covid is mainly transmitted through contact with respiratory droplets rather than through the air."
Testing - Importance,50,why covid testing,Google Search,"antibody tests cannot be used alone to rule out covid. however, they can serve an important role. using antibody tests on many patients may help the medical community better understand the immune response in patients over time and how many people may have been infected."
Testing - Importance,50,why covid testing is important,Google Search,"antibody tests cannot be used alone to rule out covid. however, they can serve an important role. using antibody tests on many patients may help the medical community better understand the immune response in patients over time and how many people may have been infected."
Testing - Importance,50,if antibody tests are not used for diagnosis or exclusion of covid infection what is their purpose,Food and Drug Administration,"antibody tests cannot be used alone to rule out covid. however, they can serve an important role. using antibody tests on many patients may help the medical community better understand the immune response in patients over time and how many people may have been infected."
Testing - Importance,50,why are we testing for covid,Author Generated,"antibody tests cannot be used alone to rule out covid. however, they can serve an important role. using antibody tests on many patients may help the medical community better understand the immune response in patients over time and how many people may have been infected."
Testing - Importance,50,do covid tests help,Author Generated,"antibody tests cannot be used alone to rule out covid. however, they can serve an important role. using antibody tests on many patients may help the medical community better understand the immune response in patients over time and how many people may have been infected."
Testing - Importance,50,what is the point of testing people for covid,Author Generated,"antibody tests cannot be used alone to rule out covid. however, they can serve an important role. using antibody tests on many patients may help the medical community better understand the immune response in patients over time and how many people may have been infected."
Prevention - DIY Hand Sanitizer,80,can i make my own hand sanitizer,John Hopkins University,"there are no studies supporting the effectiveness of homemade hand sanitizer blend in killing the new covid on peoples hands., the fda does not recommend that consumers make their own hand sanitizer. , the cdc advises using hand sanitizer that contains at least 60% alcohol. , cdc does not encourage the production and use of homemade hand sanitizer products."
Prevention - DIY Hand Sanitizer,80,if i cant find hand sanitizer in the store can i make my own,Food and Drug Administration,"there are no studies supporting the effectiveness of homemade hand sanitizer blend in killing the new covid on peoples hands., the fda does not recommend that consumers make their own hand sanitizer. , the cdc advises using hand sanitizer that contains at least 60% alcohol. , cdc does not encourage the production and use of homemade hand sanitizer products."
Prevention - DIY Hand Sanitizer,80,can i use vodka as hand sanitizer,Cable News Network,"there are no studies supporting the effectiveness of homemade hand sanitizer blend in killing the new covid on peoples hands., the fda does not recommend that consumers make their own hand sanitizer. , the cdc advises using hand sanitizer that contains at least 60% alcohol. , cdc does not encourage the production and use of homemade hand sanitizer products."
Prevention - DIY Hand Sanitizer,80,should i make my own hand sanitizer if i cant find it in the stores,Center for Disease Control,"there are no studies supporting the effectiveness of homemade hand sanitizer blend in killing the new covid on peoples hands., the fda does not recommend that consumers make their own hand sanitizer. , the cdc advises using hand sanitizer that contains at least 60% alcohol. , cdc does not encourage the production and use of homemade hand sanitizer products."
Prevention - DIY Hand Sanitizer,80,can homemade hand sanitizer replace real hand sanitizer,Author Generated,"there are no studies supporting the effectiveness of homemade hand sanitizer blend in killing the new covid on peoples hands., the fda does not recommend that consumers make their own hand sanitizer. , the cdc advises using hand sanitizer that contains at least 60% alcohol. , cdc does not encourage the production and use of homemade hand sanitizer products."
Prevention - DIY Hand Sanitizer,80,is diy hand sanitizer useful,Author Generated,"there are no studies supporting the effectiveness of homemade hand sanitizer blend in killing the new covid on peoples hands., the fda does not recommend that consumers make their own hand sanitizer. , the cdc advises using hand sanitizer that contains at least 60% alcohol. , cdc does not encourage the production and use of homemade hand sanitizer products."
Transmission - Infection by Asymptomatic Carriers,87,can someone spread the virus without being sick,Illinois Department of Public Health,"some spread might be possible before people show symptoms. , since the virus is transmitted through respiratory droplets, the risk of catching it from somebody who is asymptomatic, even a contact of a confirmed covid case, is low. , when you speak, sometimes youll spit a little bit. youll rub your nose. youll touch your mouth. youll rub your eyes. and then youll touch other surfaces, and then you will be spreading virus if you are infected and shedding asymptomatically., the risk of catching covid from someone with no symptoms at all is very low. "
Transmission - Infection by Asymptomatic Carriers,87,can i catch the virus from being in an enclosed space in close proximity to someone who doesnt have respiratory symptoms,United Nations,"some spread might be possible before people show symptoms. , since the virus is transmitted through respiratory droplets, the risk of catching it from somebody who is asymptomatic, even a contact of a confirmed covid case, is low. , when you speak, sometimes youll spit a little bit. youll rub your nose. youll touch your mouth. youll rub your eyes. and then youll touch other surfaces, and then you will be spreading virus if you are infected and shedding asymptomatically., the risk of catching covid from someone with no symptoms at all is very low. "
Transmission - Infection by Asymptomatic Carriers,87,how can someone spread covid when asymptomatic,Cable News Network,"some spread might be possible before people show symptoms. , since the virus is transmitted through respiratory droplets, the risk of catching it from somebody who is asymptomatic, even a contact of a confirmed covid case, is low. , when you speak, sometimes youll spit a little bit. youll rub your nose. youll touch your mouth. youll rub your eyes. and then youll touch other surfaces, and then you will be spreading virus if you are infected and shedding asymptomatically., the risk of catching covid from someone with no symptoms at all is very low. "
Transmission - Infection by Asymptomatic Carriers,87,can covid be caught from a person who has no symptoms,Washington DC Area Television Station,"some spread might be possible before people show symptoms. , since the virus is transmitted through respiratory droplets, the risk of catching it from somebody who is asymptomatic, even a contact of a confirmed covid case, is low. , when you speak, sometimes youll spit a little bit. youll rub your nose. youll touch your mouth. youll rub your eyes. and then youll touch other surfaces, and then you will be spreading virus if you are infected and shedding asymptomatically., the risk of catching covid from someone with no symptoms at all is very low. "
Transmission - Infection by Asymptomatic Carriers,87,are covid carriers contagious,Yahoo Search,"some spread might be possible before people show symptoms. , since the virus is transmitted through respiratory droplets, the risk of catching it from somebody who is asymptomatic, even a contact of a confirmed covid case, is low. , when you speak, sometimes youll spit a little bit. youll rub your nose. youll touch your mouth. youll rub your eyes. and then youll touch other surfaces, and then you will be spreading virus if you are infected and shedding asymptomatically., the risk of catching covid from someone with no symptoms at all is very low. "
Transmission - Infection by Asymptomatic Carriers,87,is it possible to be infected by an asymptomatic person,Author Generated,"some spread might be possible before people show symptoms. , since the virus is transmitted through respiratory droplets, the risk of catching it from somebody who is asymptomatic, even a contact of a confirmed covid case, is low. , when you speak, sometimes youll spit a little bit. youll rub your nose. youll touch your mouth. youll rub your eyes. and then youll touch other surfaces, and then you will be spreading virus if you are infected and shedding asymptomatically., the risk of catching covid from someone with no symptoms at all is very low. "
Prevention - Going Outdoors,90,can i go outdoors,Illinois Department of Public Health,"yes, go outdoors for fresh air and exercise. ride a bike, walk the dog, go for a hike, jog. social distancing does not mean staying indoors, it means avoiding close contact with people., walk dogs on a leash, maintaining at least 6 feet (2 meters) from other people and animals, do not gather in groups, and stay out of crowded places and avoid mass gatherings. "
Prevention - Going Outdoors,90,can i walk my dog,Center for Disease Control,"yes, go outdoors for fresh air and exercise. ride a bike, walk the dog, go for a hike, jog. social distancing does not mean staying indoors, it means avoiding close contact with people., walk dogs on a leash, maintaining at least 6 feet (2 meters) from other people and animals, do not gather in groups, and stay out of crowded places and avoid mass gatherings. "
Prevention - Going Outdoors,90,is it risky to leave my house to exercise,Author Generated,"yes, go outdoors for fresh air and exercise. ride a bike, walk the dog, go for a hike, jog. social distancing does not mean staying indoors, it means avoiding close contact with people., walk dogs on a leash, maintaining at least 6 feet (2 meters) from other people and animals, do not gather in groups, and stay out of crowded places and avoid mass gatherings. "
Prevention - Going Outdoors,90,will i get covid if i go outside,Author Generated,"yes, go outdoors for fresh air and exercise. ride a bike, walk the dog, go for a hike, jog. social distancing does not mean staying indoors, it means avoiding close contact with people., walk dogs on a leash, maintaining at least 6 feet (2 meters) from other people and animals, do not gather in groups, and stay out of crowded places and avoid mass gatherings. "
Prevention - Going Outdoors,90,should i get out of the house,Author Generated,"yes, go outdoors for fresh air and exercise. ride a bike, walk the dog, go for a hike, jog. social distancing does not mean staying indoors, it means avoiding close contact with people., walk dogs on a leash, maintaining at least 6 feet (2 meters) from other people and animals, do not gather in groups, and stay out of crowded places and avoid mass gatherings. "
Prevention - Going Outdoors,90,am i allowed to go out,Author Generated,"yes, go outdoors for fresh air and exercise. ride a bike, walk the dog, go for a hike, jog. social distancing does not mean staying indoors, it means avoiding close contact with people., walk dogs on a leash, maintaining at least 6 feet (2 meters) from other people and animals, do not gather in groups, and stay out of crowded places and avoid mass gatherings. "
