Category,Question ID,Question,Source,Answers
Transmission - Survivability: Surfaces,75,should i disinfect my groceries,Cable News Network,"although the new covid weakens and dies over time outside of the human body, studies suggest that it can live on surfaces for a few hours or up to several days, depending on surface, temperature and other environmental factors., clean and disinfect frequently touched surfaces, such as tables, doorknobs, light switches, countertops, handles, desks, phones, keyboards, toilets, faucets and sinks. , studies suggest that covides (including preliminary information on the covid virus) may persist on surfaces for a few hours or up to several days. this may vary under different conditions (e.g. type of surface, temperature or humidity of the environment). , yes. the likelihood of an infected person contaminating commercial goods is low and the risk of catching the virus that causes covid from a package that has been moved, travelled, and exposed to different conditions and temperature is also low. , i would suggest wiping down external surfaces of canned or wrapped foods, said dr. celine gounder, an infectious disease specialist at bellevue hospital center. , covid can stay alive for up to three days on stainless steel and plastic. but clothing is probably more like cardboard  its more absorbent, so the virus is unlikely to stay and last that long., no. the new covid cannot be transmitted through goods manufactured in china or any country reporting covid cases , viruses can live on surfaces and objects  including on money  although your chance of actually getting covid from cash is probably very low., up to three days, depending on the surface. , although the virus can survive for a short period on some surfaces, it is unlikely to be spread from domestic or international mail, products or packaging. , yes. the likelihood of an infected person contaminating commercial goods is low and the risk of catching the virus that causes covid from a package that has been moved, travelled, and exposed to different conditions and temperature is also low., it is not certain how long the virus that causes covid survives on surfaces, but it seems to behave like other covides. studies suggest that covides (including preliminary information on the covid virus) may persist on surfaces for a few hours or up to several days."
Transmission - Survivability: Surfaces,75,do i need to wash my clothes right after encountering other people,Cable News Network,"although the new covid weakens and dies over time outside of the human body, studies suggest that it can live on surfaces for a few hours or up to several days, depending on surface, temperature and other environmental factors., clean and disinfect frequently touched surfaces, such as tables, doorknobs, light switches, countertops, handles, desks, phones, keyboards, toilets, faucets and sinks. , studies suggest that covides (including preliminary information on the covid virus) may persist on surfaces for a few hours or up to several days. this may vary under different conditions (e.g. type of surface, temperature or humidity of the environment). , yes. the likelihood of an infected person contaminating commercial goods is low and the risk of catching the virus that causes covid from a package that has been moved, travelled, and exposed to different conditions and temperature is also low. , i would suggest wiping down external surfaces of canned or wrapped foods, said dr. celine gounder, an infectious disease specialist at bellevue hospital center. , covid can stay alive for up to three days on stainless steel and plastic. but clothing is probably more like cardboard  its more absorbent, so the virus is unlikely to stay and last that long., no. the new covid cannot be transmitted through goods manufactured in china or any country reporting covid cases , viruses can live on surfaces and objects  including on money  although your chance of actually getting covid from cash is probably very low., up to three days, depending on the surface. , although the virus can survive for a short period on some surfaces, it is unlikely to be spread from domestic or international mail, products or packaging. , yes. the likelihood of an infected person contaminating commercial goods is low and the risk of catching the virus that causes covid from a package that has been moved, travelled, and exposed to different conditions and temperature is also low., it is not certain how long the virus that causes covid survives on surfaces, but it seems to behave like other covides. studies suggest that covides (including preliminary information on the covid virus) may persist on surfaces for a few hours or up to several days."
Transmission - Survivability: Surfaces,75,can i get covid from a package sent from china,Cable News Network,"although the new covid weakens and dies over time outside of the human body, studies suggest that it can live on surfaces for a few hours or up to several days, depending on surface, temperature and other environmental factors., clean and disinfect frequently touched surfaces, such as tables, doorknobs, light switches, countertops, handles, desks, phones, keyboards, toilets, faucets and sinks. , studies suggest that covides (including preliminary information on the covid virus) may persist on surfaces for a few hours or up to several days. this may vary under different conditions (e.g. type of surface, temperature or humidity of the environment). , yes. the likelihood of an infected person contaminating commercial goods is low and the risk of catching the virus that causes covid from a package that has been moved, travelled, and exposed to different conditions and temperature is also low. , i would suggest wiping down external surfaces of canned or wrapped foods, said dr. celine gounder, an infectious disease specialist at bellevue hospital center. , covid can stay alive for up to three days on stainless steel and plastic. but clothing is probably more like cardboard  its more absorbent, so the virus is unlikely to stay and last that long., no. the new covid cannot be transmitted through goods manufactured in china or any country reporting covid cases , viruses can live on surfaces and objects  including on money  although your chance of actually getting covid from cash is probably very low., up to three days, depending on the surface. , although the virus can survive for a short period on some surfaces, it is unlikely to be spread from domestic or international mail, products or packaging. , yes. the likelihood of an infected person contaminating commercial goods is low and the risk of catching the virus that causes covid from a package that has been moved, travelled, and exposed to different conditions and temperature is also low., it is not certain how long the virus that causes covid survives on surfaces, but it seems to behave like other covides. studies suggest that covides (including preliminary information on the covid virus) may persist on surfaces for a few hours or up to several days."
Transmission - Survivability: Surfaces,75,can you get covid from touching money,Cable News Network,"although the new covid weakens and dies over time outside of the human body, studies suggest that it can live on surfaces for a few hours or up to several days, depending on surface, temperature and other environmental factors., clean and disinfect frequently touched surfaces, such as tables, doorknobs, light switches, countertops, handles, desks, phones, keyboards, toilets, faucets and sinks. , studies suggest that covides (including preliminary information on the covid virus) may persist on surfaces for a few hours or up to several days. this may vary under different conditions (e.g. type of surface, temperature or humidity of the environment). , yes. the likelihood of an infected person contaminating commercial goods is low and the risk of catching the virus that causes covid from a package that has been moved, travelled, and exposed to different conditions and temperature is also low. , i would suggest wiping down external surfaces of canned or wrapped foods, said dr. celine gounder, an infectious disease specialist at bellevue hospital center. , covid can stay alive for up to three days on stainless steel and plastic. but clothing is probably more like cardboard  its more absorbent, so the virus is unlikely to stay and last that long., no. the new covid cannot be transmitted through goods manufactured in china or any country reporting covid cases , viruses can live on surfaces and objects  including on money  although your chance of actually getting covid from cash is probably very low., up to three days, depending on the surface. , although the virus can survive for a short period on some surfaces, it is unlikely to be spread from domestic or international mail, products or packaging. , yes. the likelihood of an infected person contaminating commercial goods is low and the risk of catching the virus that causes covid from a package that has been moved, travelled, and exposed to different conditions and temperature is also low., it is not certain how long the virus that causes covid survives on surfaces, but it seems to behave like other covides. studies suggest that covides (including preliminary information on the covid virus) may persist on surfaces for a few hours or up to several days."
Transmission - Survivability: Surfaces,75,how long does covid stay alive on surfaces,Cable News Network,"although the new covid weakens and dies over time outside of the human body, studies suggest that it can live on surfaces for a few hours or up to several days, depending on surface, temperature and other environmental factors., clean and disinfect frequently touched surfaces, such as tables, doorknobs, light switches, countertops, handles, desks, phones, keyboards, toilets, faucets and sinks. , studies suggest that covides (including preliminary information on the covid virus) may persist on surfaces for a few hours or up to several days. this may vary under different conditions (e.g. type of surface, temperature or humidity of the environment). , yes. the likelihood of an infected person contaminating commercial goods is low and the risk of catching the virus that causes covid from a package that has been moved, travelled, and exposed to different conditions and temperature is also low. , i would suggest wiping down external surfaces of canned or wrapped foods, said dr. celine gounder, an infectious disease specialist at bellevue hospital center. , covid can stay alive for up to three days on stainless steel and plastic. but clothing is probably more like cardboard  its more absorbent, so the virus is unlikely to stay and last that long., no. the new covid cannot be transmitted through goods manufactured in china or any country reporting covid cases , viruses can live on surfaces and objects  including on money  although your chance of actually getting covid from cash is probably very low., up to three days, depending on the surface. , although the virus can survive for a short period on some surfaces, it is unlikely to be spread from domestic or international mail, products or packaging. , yes. the likelihood of an infected person contaminating commercial goods is low and the risk of catching the virus that causes covid from a package that has been moved, travelled, and exposed to different conditions and temperature is also low., it is not certain how long the virus that causes covid survives on surfaces, but it seems to behave like other covides. studies suggest that covides (including preliminary information on the covid virus) may persist on surfaces for a few hours or up to several days."
Transmission - Survivability: Surfaces,75,am i at risk for covid from mail packages or products,Center for Disease Control,"although the new covid weakens and dies over time outside of the human body, studies suggest that it can live on surfaces for a few hours or up to several days, depending on surface, temperature and other environmental factors., clean and disinfect frequently touched surfaces, such as tables, doorknobs, light switches, countertops, handles, desks, phones, keyboards, toilets, faucets and sinks. , studies suggest that covides (including preliminary information on the covid virus) may persist on surfaces for a few hours or up to several days. this may vary under different conditions (e.g. type of surface, temperature or humidity of the environment). , yes. the likelihood of an infected person contaminating commercial goods is low and the risk of catching the virus that causes covid from a package that has been moved, travelled, and exposed to different conditions and temperature is also low. , i would suggest wiping down external surfaces of canned or wrapped foods, said dr. celine gounder, an infectious disease specialist at bellevue hospital center. , covid can stay alive for up to three days on stainless steel and plastic. but clothing is probably more like cardboard  its more absorbent, so the virus is unlikely to stay and last that long., no. the new covid cannot be transmitted through goods manufactured in china or any country reporting covid cases , viruses can live on surfaces and objects  including on money  although your chance of actually getting covid from cash is probably very low., up to three days, depending on the surface. , although the virus can survive for a short period on some surfaces, it is unlikely to be spread from domestic or international mail, products or packaging. , yes. the likelihood of an infected person contaminating commercial goods is low and the risk of catching the virus that causes covid from a package that has been moved, travelled, and exposed to different conditions and temperature is also low., it is not certain how long the virus that causes covid survives on surfaces, but it seems to behave like other covides. studies suggest that covides (including preliminary information on the covid virus) may persist on surfaces for a few hours or up to several days."
Transmission - Survivability: Surfaces,75,is it safe to receive a package from any area where covid has been reported,Washington DC Area Television Station,"although the new covid weakens and dies over time outside of the human body, studies suggest that it can live on surfaces for a few hours or up to several days, depending on surface, temperature and other environmental factors., clean and disinfect frequently touched surfaces, such as tables, doorknobs, light switches, countertops, handles, desks, phones, keyboards, toilets, faucets and sinks. , studies suggest that covides (including preliminary information on the covid virus) may persist on surfaces for a few hours or up to several days. this may vary under different conditions (e.g. type of surface, temperature or humidity of the environment). , yes. the likelihood of an infected person contaminating commercial goods is low and the risk of catching the virus that causes covid from a package that has been moved, travelled, and exposed to different conditions and temperature is also low. , i would suggest wiping down external surfaces of canned or wrapped foods, said dr. celine gounder, an infectious disease specialist at bellevue hospital center. , covid can stay alive for up to three days on stainless steel and plastic. but clothing is probably more like cardboard  its more absorbent, so the virus is unlikely to stay and last that long., no. the new covid cannot be transmitted through goods manufactured in china or any country reporting covid cases , viruses can live on surfaces and objects  including on money  although your chance of actually getting covid from cash is probably very low., up to three days, depending on the surface. , although the virus can survive for a short period on some surfaces, it is unlikely to be spread from domestic or international mail, products or packaging. , yes. the likelihood of an infected person contaminating commercial goods is low and the risk of catching the virus that causes covid from a package that has been moved, travelled, and exposed to different conditions and temperature is also low., it is not certain how long the virus that causes covid survives on surfaces, but it seems to behave like other covides. studies suggest that covides (including preliminary information on the covid virus) may persist on surfaces for a few hours or up to several days."
Transmission - Survivability: Surfaces,75,does covid live on surfaces,Bing Search,"although the new covid weakens and dies over time outside of the human body, studies suggest that it can live on surfaces for a few hours or up to several days, depending on surface, temperature and other environmental factors., clean and disinfect frequently touched surfaces, such as tables, doorknobs, light switches, countertops, handles, desks, phones, keyboards, toilets, faucets and sinks. , studies suggest that covides (including preliminary information on the covid virus) may persist on surfaces for a few hours or up to several days. this may vary under different conditions (e.g. type of surface, temperature or humidity of the environment). , yes. the likelihood of an infected person contaminating commercial goods is low and the risk of catching the virus that causes covid from a package that has been moved, travelled, and exposed to different conditions and temperature is also low. , i would suggest wiping down external surfaces of canned or wrapped foods, said dr. celine gounder, an infectious disease specialist at bellevue hospital center. , covid can stay alive for up to three days on stainless steel and plastic. but clothing is probably more like cardboard  its more absorbent, so the virus is unlikely to stay and last that long., no. the new covid cannot be transmitted through goods manufactured in china or any country reporting covid cases , viruses can live on surfaces and objects  including on money  although your chance of actually getting covid from cash is probably very low., up to three days, depending on the surface. , although the virus can survive for a short period on some surfaces, it is unlikely to be spread from domestic or international mail, products or packaging. , yes. the likelihood of an infected person contaminating commercial goods is low and the risk of catching the virus that causes covid from a package that has been moved, travelled, and exposed to different conditions and temperature is also low., it is not certain how long the virus that causes covid survives on surfaces, but it seems to behave like other covides. studies suggest that covides (including preliminary information on the covid virus) may persist on surfaces for a few hours or up to several days."
Transmission - Survivability: Surfaces,75,can covid live on surfaces,Yahoo Search,"although the new covid weakens and dies over time outside of the human body, studies suggest that it can live on surfaces for a few hours or up to several days, depending on surface, temperature and other environmental factors., clean and disinfect frequently touched surfaces, such as tables, doorknobs, light switches, countertops, handles, desks, phones, keyboards, toilets, faucets and sinks. , studies suggest that covides (including preliminary information on the covid virus) may persist on surfaces for a few hours or up to several days. this may vary under different conditions (e.g. type of surface, temperature or humidity of the environment). , yes. the likelihood of an infected person contaminating commercial goods is low and the risk of catching the virus that causes covid from a package that has been moved, travelled, and exposed to different conditions and temperature is also low. , i would suggest wiping down external surfaces of canned or wrapped foods, said dr. celine gounder, an infectious disease specialist at bellevue hospital center. , covid can stay alive for up to three days on stainless steel and plastic. but clothing is probably more like cardboard  its more absorbent, so the virus is unlikely to stay and last that long., no. the new covid cannot be transmitted through goods manufactured in china or any country reporting covid cases , viruses can live on surfaces and objects  including on money  although your chance of actually getting covid from cash is probably very low., up to three days, depending on the surface. , although the virus can survive for a short period on some surfaces, it is unlikely to be spread from domestic or international mail, products or packaging. , yes. the likelihood of an infected person contaminating commercial goods is low and the risk of catching the virus that causes covid from a package that has been moved, travelled, and exposed to different conditions and temperature is also low., it is not certain how long the virus that causes covid survives on surfaces, but it seems to behave like other covides. studies suggest that covides (including preliminary information on the covid virus) may persist on surfaces for a few hours or up to several days."
Transmission - Survivability: Surfaces,75,does covid live on paper,Yahoo Search,"although the new covid weakens and dies over time outside of the human body, studies suggest that it can live on surfaces for a few hours or up to several days, depending on surface, temperature and other environmental factors., clean and disinfect frequently touched surfaces, such as tables, doorknobs, light switches, countertops, handles, desks, phones, keyboards, toilets, faucets and sinks. , studies suggest that covides (including preliminary information on the covid virus) may persist on surfaces for a few hours or up to several days. this may vary under different conditions (e.g. type of surface, temperature or humidity of the environment). , yes. the likelihood of an infected person contaminating commercial goods is low and the risk of catching the virus that causes covid from a package that has been moved, travelled, and exposed to different conditions and temperature is also low. , i would suggest wiping down external surfaces of canned or wrapped foods, said dr. celine gounder, an infectious disease specialist at bellevue hospital center. , covid can stay alive for up to three days on stainless steel and plastic. but clothing is probably more like cardboard  its more absorbent, so the virus is unlikely to stay and last that long., no. the new covid cannot be transmitted through goods manufactured in china or any country reporting covid cases , viruses can live on surfaces and objects  including on money  although your chance of actually getting covid from cash is probably very low., up to three days, depending on the surface. , although the virus can survive for a short period on some surfaces, it is unlikely to be spread from domestic or international mail, products or packaging. , yes. the likelihood of an infected person contaminating commercial goods is low and the risk of catching the virus that causes covid from a package that has been moved, travelled, and exposed to different conditions and temperature is also low., it is not certain how long the virus that causes covid survives on surfaces, but it seems to behave like other covides. studies suggest that covides (including preliminary information on the covid virus) may persist on surfaces for a few hours or up to several days."
Transmission - Survivability: Surfaces,75,can covid live on clothes,Yahoo Search,"although the new covid weakens and dies over time outside of the human body, studies suggest that it can live on surfaces for a few hours or up to several days, depending on surface, temperature and other environmental factors., clean and disinfect frequently touched surfaces, such as tables, doorknobs, light switches, countertops, handles, desks, phones, keyboards, toilets, faucets and sinks. , studies suggest that covides (including preliminary information on the covid virus) may persist on surfaces for a few hours or up to several days. this may vary under different conditions (e.g. type of surface, temperature or humidity of the environment). , yes. the likelihood of an infected person contaminating commercial goods is low and the risk of catching the virus that causes covid from a package that has been moved, travelled, and exposed to different conditions and temperature is also low. , i would suggest wiping down external surfaces of canned or wrapped foods, said dr. celine gounder, an infectious disease specialist at bellevue hospital center. , covid can stay alive for up to three days on stainless steel and plastic. but clothing is probably more like cardboard  its more absorbent, so the virus is unlikely to stay and last that long., no. the new covid cannot be transmitted through goods manufactured in china or any country reporting covid cases , viruses can live on surfaces and objects  including on money  although your chance of actually getting covid from cash is probably very low., up to three days, depending on the surface. , although the virus can survive for a short period on some surfaces, it is unlikely to be spread from domestic or international mail, products or packaging. , yes. the likelihood of an infected person contaminating commercial goods is low and the risk of catching the virus that causes covid from a package that has been moved, travelled, and exposed to different conditions and temperature is also low., it is not certain how long the virus that causes covid survives on surfaces, but it seems to behave like other covides. studies suggest that covides (including preliminary information on the covid virus) may persist on surfaces for a few hours or up to several days."
