Category,Question ID,Question,Source,Answers
Prevention - Use of Facemask,79,should i wear a face covering or face mask when i go out in public,Food and Drug Administration,"cdc recommends wearing cloth face coverings in public settings where other social distancing measures are difficult to maintain (for example, grocery stores and pharmacies) especially in areas of significant community based transmission., cover your mouth and nose with a cloth face cover when around others., in order to avoid infecting others, you should use a mask for as long as you are still coughing or sneezing. you should only stop after a complete recovery (which means 24 48 hours after having no symptoms without medication). , according to the who, for individuals without respiratory symptoms, a medical mask is not required, as no evidence is available on its usefulness to protect non sick persons., a cdc recommends wearing cloth face coverings in public when other social distancing measures are difficult to maintain (e.g., grocery stores and pharmacies) especially in areas of significant community based transmission of the covid. ,  no. surgical masks and n95s need to be reserved for use by health care workers, first responders, and other frontline workers whose jobs put them at much greater risk of acquiring covid. , the cdc recommends wearing cloth face coverings in public settings where other social distancing measures are diffcult to maintain., cdc recommends that everyone 2 years and older wear a cloth face covering that covers their nose and mouth when they are out in the community., cdc recommends that people wear a cloth face covering to cover their nose and mouth in the community setting., people with no respiratory symptoms, such as cough, do not need to wear a medical mask. who recommends the use of masks for people who have symptoms of covid and for those caring for individuals who have symptoms, such as cough and fever."
Prevention - Use of Facemask,79,should i purchase personal protective equipment for me and my family,Food and Drug Administration,"cdc recommends wearing cloth face coverings in public settings where other social distancing measures are difficult to maintain (for example, grocery stores and pharmacies) especially in areas of significant community based transmission., cover your mouth and nose with a cloth face cover when around others., in order to avoid infecting others, you should use a mask for as long as you are still coughing or sneezing. you should only stop after a complete recovery (which means 24 48 hours after having no symptoms without medication). , according to the who, for individuals without respiratory symptoms, a medical mask is not required, as no evidence is available on its usefulness to protect non sick persons., a cdc recommends wearing cloth face coverings in public when other social distancing measures are difficult to maintain (e.g., grocery stores and pharmacies) especially in areas of significant community based transmission of the covid. ,  no. surgical masks and n95s need to be reserved for use by health care workers, first responders, and other frontline workers whose jobs put them at much greater risk of acquiring covid. , the cdc recommends wearing cloth face coverings in public settings where other social distancing measures are diffcult to maintain., cdc recommends that everyone 2 years and older wear a cloth face covering that covers their nose and mouth when they are out in the community., cdc recommends that people wear a cloth face covering to cover their nose and mouth in the community setting., people with no respiratory symptoms, such as cough, do not need to wear a medical mask. who recommends the use of masks for people who have symptoms of covid and for those caring for individuals who have symptoms, such as cough and fever."
Prevention - Use of Facemask,79,should i wear a face mask in public,Cable News Network,"cdc recommends wearing cloth face coverings in public settings where other social distancing measures are difficult to maintain (for example, grocery stores and pharmacies) especially in areas of significant community based transmission., cover your mouth and nose with a cloth face cover when around others., in order to avoid infecting others, you should use a mask for as long as you are still coughing or sneezing. you should only stop after a complete recovery (which means 24 48 hours after having no symptoms without medication). , according to the who, for individuals without respiratory symptoms, a medical mask is not required, as no evidence is available on its usefulness to protect non sick persons., a cdc recommends wearing cloth face coverings in public when other social distancing measures are difficult to maintain (e.g., grocery stores and pharmacies) especially in areas of significant community based transmission of the covid. ,  no. surgical masks and n95s need to be reserved for use by health care workers, first responders, and other frontline workers whose jobs put them at much greater risk of acquiring covid. , the cdc recommends wearing cloth face coverings in public settings where other social distancing measures are diffcult to maintain., cdc recommends that everyone 2 years and older wear a cloth face covering that covers their nose and mouth when they are out in the community., cdc recommends that people wear a cloth face covering to cover their nose and mouth in the community setting., people with no respiratory symptoms, such as cough, do not need to wear a medical mask. who recommends the use of masks for people who have symptoms of covid and for those caring for individuals who have symptoms, such as cough and fever."
Prevention - Use of Facemask,79,should children wear masks,Center for Disease Control,"cdc recommends wearing cloth face coverings in public settings where other social distancing measures are difficult to maintain (for example, grocery stores and pharmacies) especially in areas of significant community based transmission., cover your mouth and nose with a cloth face cover when around others., in order to avoid infecting others, you should use a mask for as long as you are still coughing or sneezing. you should only stop after a complete recovery (which means 24 48 hours after having no symptoms without medication). , according to the who, for individuals without respiratory symptoms, a medical mask is not required, as no evidence is available on its usefulness to protect non sick persons., a cdc recommends wearing cloth face coverings in public when other social distancing measures are difficult to maintain (e.g., grocery stores and pharmacies) especially in areas of significant community based transmission of the covid. ,  no. surgical masks and n95s need to be reserved for use by health care workers, first responders, and other frontline workers whose jobs put them at much greater risk of acquiring covid. , the cdc recommends wearing cloth face coverings in public settings where other social distancing measures are diffcult to maintain., cdc recommends that everyone 2 years and older wear a cloth face covering that covers their nose and mouth when they are out in the community., cdc recommends that people wear a cloth face covering to cover their nose and mouth in the community setting., people with no respiratory symptoms, such as cough, do not need to wear a medical mask. who recommends the use of masks for people who have symptoms of covid and for those caring for individuals who have symptoms, such as cough and fever."
Prevention - Use of Facemask,79,does cdc recommend the use of facemask or face coverings to prevent covid,Center for Disease Control,"cdc recommends wearing cloth face coverings in public settings where other social distancing measures are difficult to maintain (for example, grocery stores and pharmacies) especially in areas of significant community based transmission., cover your mouth and nose with a cloth face cover when around others., in order to avoid infecting others, you should use a mask for as long as you are still coughing or sneezing. you should only stop after a complete recovery (which means 24 48 hours after having no symptoms without medication). , according to the who, for individuals without respiratory symptoms, a medical mask is not required, as no evidence is available on its usefulness to protect non sick persons., a cdc recommends wearing cloth face coverings in public when other social distancing measures are difficult to maintain (e.g., grocery stores and pharmacies) especially in areas of significant community based transmission of the covid. ,  no. surgical masks and n95s need to be reserved for use by health care workers, first responders, and other frontline workers whose jobs put them at much greater risk of acquiring covid. , the cdc recommends wearing cloth face coverings in public settings where other social distancing measures are diffcult to maintain., cdc recommends that everyone 2 years and older wear a cloth face covering that covers their nose and mouth when they are out in the community., cdc recommends that people wear a cloth face covering to cover their nose and mouth in the community setting., people with no respiratory symptoms, such as cough, do not need to wear a medical mask. who recommends the use of masks for people who have symptoms of covid and for those caring for individuals who have symptoms, such as cough and fever."
Prevention - Use of Facemask,79,should i wear a mask to protect myself,Washington DC Area Television Station,"cdc recommends wearing cloth face coverings in public settings where other social distancing measures are difficult to maintain (for example, grocery stores and pharmacies) especially in areas of significant community based transmission., cover your mouth and nose with a cloth face cover when around others., in order to avoid infecting others, you should use a mask for as long as you are still coughing or sneezing. you should only stop after a complete recovery (which means 24 48 hours after having no symptoms without medication). , according to the who, for individuals without respiratory symptoms, a medical mask is not required, as no evidence is available on its usefulness to protect non sick persons., a cdc recommends wearing cloth face coverings in public when other social distancing measures are difficult to maintain (e.g., grocery stores and pharmacies) especially in areas of significant community based transmission of the covid. ,  no. surgical masks and n95s need to be reserved for use by health care workers, first responders, and other frontline workers whose jobs put them at much greater risk of acquiring covid. , the cdc recommends wearing cloth face coverings in public settings where other social distancing measures are diffcult to maintain., cdc recommends that everyone 2 years and older wear a cloth face covering that covers their nose and mouth when they are out in the community., cdc recommends that people wear a cloth face covering to cover their nose and mouth in the community setting., people with no respiratory symptoms, such as cough, do not need to wear a medical mask. who recommends the use of masks for people who have symptoms of covid and for those caring for individuals who have symptoms, such as cough and fever."
Prevention - Use of Facemask,79,can wearing a face mask prevent covid,Quora,"cdc recommends wearing cloth face coverings in public settings where other social distancing measures are difficult to maintain (for example, grocery stores and pharmacies) especially in areas of significant community based transmission., cover your mouth and nose with a cloth face cover when around others., in order to avoid infecting others, you should use a mask for as long as you are still coughing or sneezing. you should only stop after a complete recovery (which means 24 48 hours after having no symptoms without medication). , according to the who, for individuals without respiratory symptoms, a medical mask is not required, as no evidence is available on its usefulness to protect non sick persons., a cdc recommends wearing cloth face coverings in public when other social distancing measures are difficult to maintain (e.g., grocery stores and pharmacies) especially in areas of significant community based transmission of the covid. ,  no. surgical masks and n95s need to be reserved for use by health care workers, first responders, and other frontline workers whose jobs put them at much greater risk of acquiring covid. , the cdc recommends wearing cloth face coverings in public settings where other social distancing measures are diffcult to maintain., cdc recommends that everyone 2 years and older wear a cloth face covering that covers their nose and mouth when they are out in the community., cdc recommends that people wear a cloth face covering to cover their nose and mouth in the community setting., people with no respiratory symptoms, such as cough, do not need to wear a medical mask. who recommends the use of masks for people who have symptoms of covid and for those caring for individuals who have symptoms, such as cough and fever."
Prevention - Use of Facemask,79,do masks help prevent the spread of covid,Quora,"cdc recommends wearing cloth face coverings in public settings where other social distancing measures are difficult to maintain (for example, grocery stores and pharmacies) especially in areas of significant community based transmission., cover your mouth and nose with a cloth face cover when around others., in order to avoid infecting others, you should use a mask for as long as you are still coughing or sneezing. you should only stop after a complete recovery (which means 24 48 hours after having no symptoms without medication). , according to the who, for individuals without respiratory symptoms, a medical mask is not required, as no evidence is available on its usefulness to protect non sick persons., a cdc recommends wearing cloth face coverings in public when other social distancing measures are difficult to maintain (e.g., grocery stores and pharmacies) especially in areas of significant community based transmission of the covid. ,  no. surgical masks and n95s need to be reserved for use by health care workers, first responders, and other frontline workers whose jobs put them at much greater risk of acquiring covid. , the cdc recommends wearing cloth face coverings in public settings where other social distancing measures are diffcult to maintain., cdc recommends that everyone 2 years and older wear a cloth face covering that covers their nose and mouth when they are out in the community., cdc recommends that people wear a cloth face covering to cover their nose and mouth in the community setting., people with no respiratory symptoms, such as cough, do not need to wear a medical mask. who recommends the use of masks for people who have symptoms of covid and for those caring for individuals who have symptoms, such as cough and fever."
Prevention - General,97,what can i do to protect myself and prevent the spread of disease,Washington DC Area Television Station,"the best way to prevent illness is to avoid being exposed to the virus. , stay at least 6 feet away from others, and wash your hands often. , regularly and thoroughly clean your hands with an alcohol based hand rub or wash them with soap and water. maintain at least 3 feet distance between yourself and anyone who is coughing or sneezing."
Prevention - General,97,how can i prevent covid,Food and Drug Administration,"the best way to prevent illness is to avoid being exposed to the virus. , stay at least 6 feet away from others, and wash your hands often. , regularly and thoroughly clean your hands with an alcohol based hand rub or wash them with soap and water. maintain at least 3 feet distance between yourself and anyone who is coughing or sneezing."
Prevention - General,97,whats the best way to prevent covid,Cable News Network,"the best way to prevent illness is to avoid being exposed to the virus. , stay at least 6 feet away from others, and wash your hands often. , regularly and thoroughly clean your hands with an alcohol based hand rub or wash them with soap and water. maintain at least 3 feet distance between yourself and anyone who is coughing or sneezing."
Prevention - General,97,how can i make sure to not get affected with the novel covid virus,Quora,"the best way to prevent illness is to avoid being exposed to the virus. , stay at least 6 feet away from others, and wash your hands often. , regularly and thoroughly clean your hands with an alcohol based hand rub or wash them with soap and water. maintain at least 3 feet distance between yourself and anyone who is coughing or sneezing."
Prevention - General,97,how do i keep safe from covid,Quora,"the best way to prevent illness is to avoid being exposed to the virus. , stay at least 6 feet away from others, and wash your hands often. , regularly and thoroughly clean your hands with an alcohol based hand rub or wash them with soap and water. maintain at least 3 feet distance between yourself and anyone who is coughing or sneezing."
Prevention - General,97,how do i stop covid,Quora,"the best way to prevent illness is to avoid being exposed to the virus. , stay at least 6 feet away from others, and wash your hands often. , regularly and thoroughly clean your hands with an alcohol based hand rub or wash them with soap and water. maintain at least 3 feet distance between yourself and anyone who is coughing or sneezing."
Prevention - General,97,how can we take precaution to stop covid,Quora,"the best way to prevent illness is to avoid being exposed to the virus. , stay at least 6 feet away from others, and wash your hands often. , regularly and thoroughly clean your hands with an alcohol based hand rub or wash them with soap and water. maintain at least 3 feet distance between yourself and anyone who is coughing or sneezing."
Prevention - General,97,how do we protect ourselves,Quora,"the best way to prevent illness is to avoid being exposed to the virus. , stay at least 6 feet away from others, and wash your hands often. , regularly and thoroughly clean your hands with an alcohol based hand rub or wash them with soap and water. maintain at least 3 feet distance between yourself and anyone who is coughing or sneezing."
Prevention - General,97,how are you avoiding gaining the covid,Quora,"the best way to prevent illness is to avoid being exposed to the virus. , stay at least 6 feet away from others, and wash your hands often. , regularly and thoroughly clean your hands with an alcohol based hand rub or wash them with soap and water. maintain at least 3 feet distance between yourself and anyone who is coughing or sneezing."
Prevention - General,97,what advice should we follow against covid,Quora,"the best way to prevent illness is to avoid being exposed to the virus. , stay at least 6 feet away from others, and wash your hands often. , regularly and thoroughly clean your hands with an alcohol based hand rub or wash them with soap and water. maintain at least 3 feet distance between yourself and anyone who is coughing or sneezing."
Prevention - General,97,is there a way to not get covid,Author Generated,"the best way to prevent illness is to avoid being exposed to the virus. , stay at least 6 feet away from others, and wash your hands often. , regularly and thoroughly clean your hands with an alcohol based hand rub or wash them with soap and water. maintain at least 3 feet distance between yourself and anyone who is coughing or sneezing."
Prevention - General,97,how is covid prevented,Author Generated,"the best way to prevent illness is to avoid being exposed to the virus. , stay at least 6 feet away from others, and wash your hands often. , regularly and thoroughly clean your hands with an alcohol based hand rub or wash them with soap and water. maintain at least 3 feet distance between yourself and anyone who is coughing or sneezing."
Prevention - Alternative Disinfection,99,what alternatives do i have if there are no hand sanitizers available,United Nations,"if hand sanitizers are not available, hand washing with soap and water is the recommended, and even better, alternative. , handwashing is one of the best ways to protect yourself and your family from getting sick. if soap and water are not readily available, use an alcohol based hand sanitizer with at least 60% alcohol., the efficacy of these disinfection methods against the virus that causes covid is not known., if surfaces are dirty, clean them using detergent or soap and water prior to disinfection. to disinfect, most common epa registered household disinfectants will work. see "
Prevention - Alternative Disinfection,99,should i use soap and water or a hand sanitizer to protect against covid,Center for Disease Control,"if hand sanitizers are not available, hand washing with soap and water is the recommended, and even better, alternative. , handwashing is one of the best ways to protect yourself and your family from getting sick. if soap and water are not readily available, use an alcohol based hand sanitizer with at least 60% alcohol., the efficacy of these disinfection methods against the virus that causes covid is not known., if surfaces are dirty, clean them using detergent or soap and water prior to disinfection. to disinfect, most common epa registered household disinfectants will work. see "
Prevention - Alternative Disinfection,99,how effective are alternative disinfection methods,Center for Disease Control,"if hand sanitizers are not available, hand washing with soap and water is the recommended, and even better, alternative. , handwashing is one of the best ways to protect yourself and your family from getting sick. if soap and water are not readily available, use an alcohol based hand sanitizer with at least 60% alcohol., the efficacy of these disinfection methods against the virus that causes covid is not known., if surfaces are dirty, clean them using detergent or soap and water prior to disinfection. to disinfect, most common epa registered household disinfectants will work. see "
Prevention - Alternative Disinfection,99,what cleaning products should i use to protect against covid,Center for Disease Control,"if hand sanitizers are not available, hand washing with soap and water is the recommended, and even better, alternative. , handwashing is one of the best ways to protect yourself and your family from getting sick. if soap and water are not readily available, use an alcohol based hand sanitizer with at least 60% alcohol., the efficacy of these disinfection methods against the virus that causes covid is not known., if surfaces are dirty, clean them using detergent or soap and water prior to disinfection. to disinfect, most common epa registered household disinfectants will work. see "
Prevention - Alternative Disinfection,99,does alcohol kill covid,Quora,"if hand sanitizers are not available, hand washing with soap and water is the recommended, and even better, alternative. , handwashing is one of the best ways to protect yourself and your family from getting sick. if soap and water are not readily available, use an alcohol based hand sanitizer with at least 60% alcohol., the efficacy of these disinfection methods against the virus that causes covid is not known., if surfaces are dirty, clean them using detergent or soap and water prior to disinfection. to disinfect, most common epa registered household disinfectants will work. see "
Prevention - Alternative Disinfection,99,can i kill covid without hand sanitizer,Author Generated,"if hand sanitizers are not available, hand washing with soap and water is the recommended, and even better, alternative. , handwashing is one of the best ways to protect yourself and your family from getting sick. if soap and water are not readily available, use an alcohol based hand sanitizer with at least 60% alcohol., the efficacy of these disinfection methods against the virus that causes covid is not known., if surfaces are dirty, clean them using detergent or soap and water prior to disinfection. to disinfect, most common epa registered household disinfectants will work. see "
Prevention - Alternative Disinfection,99,is it possible to disinfect surfaces with alternative disinfection methods,Author Generated,"if hand sanitizers are not available, hand washing with soap and water is the recommended, and even better, alternative. , handwashing is one of the best ways to protect yourself and your family from getting sick. if soap and water are not readily available, use an alcohol based hand sanitizer with at least 60% alcohol., the efficacy of these disinfection methods against the virus that causes covid is not known., if surfaces are dirty, clean them using detergent or soap and water prior to disinfection. to disinfect, most common epa registered household disinfectants will work. see "
Prevention - Alternative Disinfection,99,is there a way to kill covid without hand sanitizer,Author Generated,"if hand sanitizers are not available, hand washing with soap and water is the recommended, and even better, alternative. , handwashing is one of the best ways to protect yourself and your family from getting sick. if soap and water are not readily available, use an alcohol based hand sanitizer with at least 60% alcohol., the efficacy of these disinfection methods against the virus that causes covid is not known., if surfaces are dirty, clean them using detergent or soap and water prior to disinfection. to disinfect, most common epa registered household disinfectants will work. see "
